Title,ID,Datatype,Description,Example,Inverse,Domain 1,Domain 2
German municipality key,439,string,identifier for municipalities and independent towns in Germany,,
German district key,440,string,identifier for districts (Landkreise) and independent towns in Germany,,
China administrative division code,442,string,identifier for administrative divisions of People's Republic of China (with spaces),,
pronunciation audio,443,Commons file,audio media file on Wikimedia Commons with pronunciation,,
review score,444,string,review score received by a creative work,,
score by,447,item,issuer of a review score,,
launch site,448,item,site or launch pad from where the spacecraft was launched,,
original network,449,item,network(s) the radio or television show was originally aired on. This does not include later re-runs or additional syndication.,,
astronaut mission,450,item,space mission that the subject is or has been a member of (do not include future missions),,
cohabitant,451,item,"Someone with whom the person is in a relationship without being married. Use ""spouse"" for married couples.",,
industry,452,item,industry of company or organization,,
character role,453,item,specific role played or filled by subject (use only as qualifier of P161 or P725),,
Structurae ID (structure),454,string,"identifier for a building in the Structurae database (""s"" or 'p' + 7 digits)",,
Emporis ID,455,string,identifier for a building in the Emporis database,,
foundational text,457,item,text through which an institution has been created,,
IMO ship number,458,string,ship identifier per IMO,,
determination method,459,item,qualifier stating how a value has been determined,,
said to be the same as,460,item,"this item is said to be the same as that item, but the statement is disputed",,
opposite of,461,item,item that is the opposite of this item,,
color,462,item,color of subject,,
member of,463,item,"part of a specific organization or club. Do not use for membership in ethnic or social groups, nor for holding a position such as a member of parliament (use P39 for that).",,
NOR,464,string,ID for French official texts,,
sRGB color hex triplet,465,string,sRGB hex triplet format for subject color (e.g. 7FFFD4),,
occupant,466,item,person or organization occupying a building or facility,,
legislated by,467,item,indicates that an act or bill was passed by a legislature.  The value can be a particular session of the legislature,,
dan/kyu rank,468,item,"rank system used in several board games (e.g. go, shogi, renju), martial arts (e.g. judo, kendo, wushu) and some other games",,
lakes on river,469,item,"lakes and reservoirs the river flows through, flows into or flows out of",,
Eight Banner register,470,item,Manchu household register for people of the Qing Dynasty,,
local dialing code,473,string,identifier dedicated to subject city by the area communication network,,
country calling code,474,string,dialed on phone for a country after the international dialing prefix (precede value by +),,
CELEX number,476,string,ID for European legal texts in EUR-Lex database,,
Canadian Register of Historic Places identifier,477,string,identifier in the Canadian Register of Historic Places,,
volume,478,string,"volume of a book in a collection/series, for reference",,
input device,479,item,input method or device used to interact with a software product,,
FilmAffinity identifier,480,string,FilmAffinity identification number of a creative work,,
Palissy identifier,481,string,identifier in the Palissy database of moveable objects of French cultural heritage,,
recorded (at),483,item,studio where a musical composition was recorded,,
"IMA Number, broad sense",484,string,mineral identifier per the International Mineralogical Association,,
archives at,485,item,the institution holding the subject's archives,,
MeSH ID,486,string,unique ID in the MeSH descriptor database,,
Unicode character,487,string,Unicode character representing the item,,
chairperson,488,item,"presiding member of an organization, group or body",,
currency symbol description,489,item,item with description of currency symbol,,
provisional designation,490,string,designation of an astronomical body after its discovery and before its official name,,
orbit diagram,491,Commons file,image with the diagram of the orbit of an astronomic body,,
OMIM ID,492,string,"Online ""Mendelian Inheritance in Man"" catalogue codes for diseases",,
ICD-9,493,string,ICD catalogue codes for diseases \u2013 Version 9,,
ICD-10,494,string,ICD catalogue codes for diseases - Version 10,,
country of origin,495,item,country of origin of the creative work or subject item,,
ORCID,496,string,Open Research Contributor ID for a person,,
CBDB ID,497,string,ID of a person in the China Biographical Database,,
ISO 4217 code,498,string,ISO 4217 code of currency,,
exclave of,500,item,territory is legally or politically attached to a main territory with which it is not physically contiguous because of surrounding alien territory. It may also be an enclave.,,
enclave within,501,item,territory is entirely surrounded by the other (enclaved),,
HURDAT identifier,502,string,the subject's HURDAT (North Atlantic hurricane database) identifier,,
ISO standard,503,string,number of the ISO standard which normalizes the object,,
home port,504,item,"home port of the vessel (if different from ""ship registry""): For civilian ships, the primary port from which the ship operates. Port of registry (the one painted on the stern) should be listed in ""Ship registry"". For warships, this will be the ship's assigned naval base",,
general manager,505,item,general manager of a sports team,,
ISO 15924,506,string,code for writing systems,,
Swedish county code,507,string,"identifier for a county in Sweden ""l\u00e4nskod"" (two-digit)",,
BNCF Thesaurus,508,string,link to Italian national thesaurus at BNCF,,
cause of death,509,item,"underlying or immediate cause of death.  Underlying cause (e.g. car accident, stomach cancer) preferred.  Use 'manner of death' (P1196) for broadest category, e.g. natural causes, accident, homicide, suicide",,
honorific prefix,511,item,"word or expression used before a name, in addressing or referring to a person",,
academic degree,512,item,academic degree that the person holds,,
birth name,513,string,"name at birth, only if different from current name",,
interleaves with,514,item,stratigraphic relation in which two units overlap each other marginally,,
phase of matter,515,item,"state or phase of the matter at which the measure was made (gas, liquid, solid... See talk page)",,
powerplant,516,item,equipment or engine used to power the subject,,
interaction,517,item,"with which of the 4 fundamental forces does the particle interact? strong interaction Q11415, electromagnetic: Q849919, weak interaction: Q11418, gravitation: Q11412",,
applies to part,518,item,part of the item for which the claim is valid,,
armament,520,item,equippable weapon item for the subject,,
scheduled service destination,521,item,airport or station connected by regular direct service to the subject,,
type of orbit,522,item,orbit a satellite has around its central body,,
temporal range start,523,item,the start of a process or appearance of a life form relative to the geologic time scale,,
temporal range end,524,item,the end of a process or extinction of a life form relative to the geologic time scale,,
Swedish municipality code,525,string,"identifier for a municipality in Sweden ""kommunkod"" (four-digit)",,
has part,527,item,object is a part of this subject,,
catalog code,528,string,"catalogue name of an object, use with qualifier P972",,
runway,529,string,name (direction) of runway at airport/airfield/airstrip,,
diplomatic relation,530,item,diplomatic relations of the country,,
diplomatic mission sent,531,item,"location of diplomatic mission, i.e. consulate of A in the capital city of B",,
port of registry,532,item,"ship's port of registry. This is generally painted on the ship's stern (for the ""home port"", see Property:P504)",,
target,533,item,target of a terrorist attack or military operation,,
streak color,534,item,color of a mineral or material when abraded,,
Find a Grave ID,535,string,the subject's ID in the Find a Grave database,,
ATP ID,536,string,ATP tennis male player identifier,,
twinning,537,item,type of twins a crystal forms,,
fracturing,538,item,type of fracture a crystal or mineral forms,,
Museofile,539,string,ID of a museum in the Museofile database of the French ministry of culture,,
office contested,541,item,title of office which election will determine the next holder of,,
officially opened by,542,item,person that officially opened the event,,
oath made by,543,item,"person(s) that made the oath at an event, like the Olympic Games",,
torch lit by,545,item,"person that lit the torch at an event, like the Olympic Games",,
docking port,546,item,docking port for the dock,,
commemorates,547,item,"what the place, monument, memorial, holiday, commemorates",,
version type,548,item,type of version (qualifier for P348),,
Mathematics Genealogy Project identifier,549,string,identifier for mathematicians and computer scientists at the Mathematics Genealogy Project,,
chivalric order,550,item,the chivalric order which a person belongs to,,
residence,551,item,"the place where the person is, or has been, resident",,
handedness,552,item,handedness of the person,,
website account on,553,item,a website that the person or organization has an account on (use with P554) Note: only used with reliable source or if the person or organization disclosed it.,,
website username,554,string,username on a website that the person or organization has an account on (only use as qualifier of P553),,
doubles record,555,string,win/lose balance for a player in doubles tournaments,,
crystal system,556,item,type of crystal for crystal coumpounds,,
DiseasesDB,557,string,identifier sourced on the Diseases Database,,
unit symbol,558,string,symbol of a unit,,
terminus,559,item,"the feature (intersecting road, train station, etc.) at the terminus of a linear feature",,
direction,560,item,a directional identifier of something,,
NATO reporting name,561,string,official reporting name assigned by the ASCC for NATO use,,
central bank/issuer,562,item,central bank or other issuing authority for the currency,,
ICD-O,563,string,International Classification of Diseases for Oncology,,
singles record,564,string,win/lose balance for a player in singles tournaments,,
crystal habit,565,item,the proportions of a crystal or mineral,,
basionym,566,item,"the legitimate, previously published name on which a new combination or name at new rank is based",,
hangingwall,567,item,item that is in the hanging wall of this item,,
footwall,568,item,item that is in the footwall of this item,,
date of birth,569,time,date on which the subject was born,,
date of death,570,time,date on which the subject died,,
date of foundation or creation,571,time,when the organization/object was founded/created,,
date of scientific description,574,time,publication date of the scientific name,,
discovery date,575,time,when the item was discovered,,
date of dissolution,576,time,date on which the organisation was dissolved,,
date of publication,577,time,date when this work was published,,
Sandbox-TimeValue,578,time,"Sandbox property for value of type ""TimeValue""",,
IMA status,579,item,status given to each mineral by the IMA (International Mineralogical Association),,
start date,580,time,"indicates the time an item begins to exist or a statement starts being valid, usually used as a qualifier",,
end date,582,time,indicates the time an item ceases to exist or a statement stops being valid,,
point in time,585,time,"time and date something took place, existed or a statement was true",,
IPNI author ID,586,string,ID of a person in the International Plant Names Index,,
MMSI,587,string,Maritime Mobile Service Identity of a ship station,,
coolant,588,item,substance used by the subject to dissipate excess thermal energy,,
point group,589,item,crystal subdivision,,
GNIS ID,590,string,"official identification code for geographic objects in the US. For Antarctica, use Property:P804",,
EC number,591,string,Enzyme Commission number (\u2260 European Commission number P232),,
ChEMBL ID,592,string,chemical database of bioactive molecules with drug-like properties,,
HomoloGene ID,593,string,identification,,
Ensembl Gene ID,594,string,gene identifier as per the Ensembl ( European Bioinformatics Institute and the Wellcome Trust Sanger Institute)  database,,
IUPHAR ID,595,string,ID of the International Union of Pharmacology databank,,
WTA ID,597,string,WTA tennis female player identifier,,
commands,598,item,"for persons who are notable as commanding officers, the units they commanded",,
ITF ID,599,string,ITF tennis player identifier,,
Wine AppDB-ID,600,string,Application-ID in the the AppDB of WineHQ,,
MedlinePlus ID,604,string,"health information from U.S. government agencies, and health-related organizations",,
NUTS code,605,string,NUTS-Code of a region,,
first flight,606,time,date on which aircraft first flew,,
conflict,607,item,"battles, wars or engagements in which the person or item participated",,
exhibition history,608,item,exhibitions where the item was displayed,,
terminus location,609,item,location of the terminus of a linear feature,,
highest point,610,item,"point with highest elevation in the country, region, city or area",,
religious order,611,item,order of monks or nuns which the monastery housed,,
mother house,612,item,name of the mother house,,
OS grid reference,613,string,grid location reference from the Ordnance Survey National Grid reference system used in Great Britain,,
CHRC,616,string,Cultural heritage registration code (Iran),,
yard number,617,string,number of the ship assigned by its builder (shipyard),,
source of energy,618,item,describes the source of energy an animated object (machine or animal) uses,,
spacecraft launch date,619,time,date and time in UTC,,
spacecraft landing date,620,time,spacecraft landing date in UTC,,
spacecraft decay date,621,time,spacecraft orbit decay date in UTC,,
spacecraft docking/undocking dates,622,time,,,
guidance system,624,item,guidance system of a missile,,
coordinate location,625,geo coordinate,geocoordinates of the subject,,
Sandbox-GeoCoordinateValue,626,geo coordinate,"Sandbox property for value of type ""GeoCoordinateValue""",,
IUCN-ID,627,string,source for IUCN conservation status (P141),,
E number,628,string,number for food additives that are legal in the European Union,,
edition or translation of,629,item,is an edition or translation of this text,,
Paris city digital code,630,string,digital identifier for streets in Paris,,
structural engineer,631,item,"person, group or organisation responsible for the structural engineering of a building or structure",,
cultural properties of Belarus reference number,632,string,,,
R\u00e9pertoire du patrimoine culturel du Qu\u00e9bec identifier,633,string,Identification number in the directory of the cultural heritage of Quebec,,
captain,634,item,captain of this sports team,,
ISTAT ID,635,string,identifier for municipalities in Italy,,
route of administration,636,item,"path by which a drug, fluid, poison, or other substance is taken into the body",,
RefSeq Protein ID,637,string,protein Identifier,,
PDB ID,638,string,gene entry for 3D structural data as per the PDB(Protein Data Bank) database,,
RefSeq RNA ID,639,string,RNA Identifier,,
L\u00e9onore ID,640,string,ID of a person in the L\u00e9onore database,,
sport,641,item,sport or discipline in which the entity participates or belongs to,,
of,642,item,qualifiers stating that a statement applies within the scope of a particular item,,
"Genloc Chr (deprecated, use P1057)",643,string,"(deprecated, use P1057) database chapter of the gene in UCSC Genome Informatics website",,
genomic start,644,string,genomic starting coordinate of the biological sequence (e.g. a gene),,
genomic end,645,string,genomic ending coordinate of the biological sequence (e.g. a gene),,
Freebase identifier,646,string,ID specifying an equivalent page in the Freebase open knowledge graph,,
drafted by,647,item,which team the player was drafted by,,
Open Library identifier,648,string,"numeric identifier for works, editions and authors",,
NRHP reference number,649,string,National Register of Historic Places reference number assigned by the National Park Service of the USA,,
RKDartists,650,string,ID in the RKDartists database (Rijksbureau voor Kunsthistorische Documentatie),,
Biografisch Portaal number,651,string,ID at Biografisch Portaal van Nederland,,
UNII,652,string,Unique Ingredient Identifier,,
PubMed Health,653,string,ID published by the PubMed Health website,,
direction relative to location,654,item,qualifier for geographical locations to express relative direction,,
translator,655,item,people or organisation who translated this,,
RefSeq,656,string,qualifier to specify Reference Sequence identifier for the Protein and RNA (either p637 or p639),,
RTECS number,657,string,chemical identifier from the Registry of Toxic Effects of Chemical Substances,,
tracklist,658,item,songs contained in this item,,
GenLoc assembly,659,item,specify the genome assembly of the gene in UCSC Genome Informatics website,,
EC classification,660,item,the Enzyme Commission (EC)-based accepted name of any enzyme classifications of the protein or RNA molecule,,
ChemSpider ID,661,string,"free chemical database, owned by the Royal Society of Chemistry",,
PubChem ID (CID),662,string,database of chemical molecules and their activities in biological assays (only CID number),,
DSM IV,663,string,classification found in the Diagnostic and Statistical Manual of Mental Disorders,,
organizer,664,item,person or institution organizing an event,,
KEGG ID,665,string,"databases dealing with genomes, enzymatic pathways, and biological chemicals",,
ICPC 2 ID,667,string,classification method for primary care encounters,,
GeneReviews ID,668,string,collection of peer-reviewed articles that describe specific gene-releated diseases,,
street,669,item,"street, or road, where the item is located. To add the number, use Property:P670 ""street number"" as qualifier",,
street number,670,string,"number in the street address. To be used as a qualifier of Property:P669 ""street""",,
Mouse Genome Informatics ID,671,string,ID of a gene in the Mouse Genome Informatics database,,
MeSH Code,672,string,Medical Subject Headings (MeSH) codes are an index and thesaurus for the life sciences (\u2260 MeSH ID),,
eMedicine,673,string,online clinical medical knowledge base,,
characters,674,item,"characters which occurs on this item (plays, operas, operettas, books,...)",,
Google Books identifier,675,string,This identifier gives access to the books that Google has scanned,,
lyrics by,676,item,author of song lyrics; also use P86 for music composer,,
\u00daSOP code,677,string,"identifier in drusop.nature.cz, a national database of protected areas and trees",,
incertae sedis,678,item,qualifier for P171 (parent taxon) to mark which intermediate ranks are incertae sedis,,
ZVG number,679,string,identifier of GESTIS database,,
molecular function,680,item,represents gene ontology function annotations,,
cell component,681,item,component of the cell in which this item is present,,
biological process,682,item,is involved in the biological process,,
ChEBI ID,683,string,database and ontology of molecular entities focused on 'small' chemical compounds,,
ortholog,684,item,orthologous gene in another species (use with 'species' qualifier),,
NCBI Taxonomy ID,685,string,ID of a taxon in the Taxonomy Database by the National Center for Biotechnology Information,,
Gene Ontology ID,686,string,ID in the Gene Ontology,,
BHL Page Id,687,string,identifier in the Biodiversity Heritage Library (BHL),,
encodes,688,item,the product of a gene (protein or RNA),,
afflicts,689,item,a type of organism which a condition or disease afflicts,,
space group,690,item,symmetry classification for 2 and 3 dimensional patterns or crystals,,
NKC identifier,691,string,ID in National authority file of the Czech Republic (National Library of CR),,
Gene Atlas Image,692,Commons file,image showing the GeneAtlas expression pattern,,
cleavage,693,item,way that crystals or minerals cleave,,
replaced synonym (for nom. nov.),694,item,"previously published name on which a replacement name (avowed substitute, nomen novum) is based.",,
UN number,695,string,"four-digit numbers that identify hazardous substances, and articles (such as explosives, flammable liquids, toxic substances, etc.) in the framework of international transport",,
Neurolex ID,696,string,ID in the Neurolex database,,
ex taxon author,697,item,"person to whom to ascribe a taxon name, denoted by ""ex"" (via P405)",,
PubMed ID,698,string,ID for journal articles/abstracts in PubMed,,
Disease Ontology ID,699,string,ID in the Disease Ontology database,,
Kemler ID,700,string,code describing the hazards of a chemical in transport,,
Dodis,701,string,"identifier in the dodis database (Diplomatic Documents of Switzerland 1945-1969), see Q661051",,
encoded by,702,item,the gene that encodes some gene product,,
found in taxon,703,item,the taxon in which the molecule or substance can be found,,
Ensembl Transcript ID,704,string,transcript ID issued by Ensembl database,,
Ensembl Protein ID,705,string,protein ID issued by Ensembl database,,
located on terrain feature,706,item,"located on the specified landform or body of water. Should not be used when the value is only political/administrative (provinces, states, countries, etc.).",,
satellite bus,707,item,general model on which multiple-production satellite spacecraft is based,,
diocese,708,item,administrative division of the church to which the element belongs,,
Historic Scotland ID,709,string,,,
participant,710,item,"person, group of people or organization that actively takes/took part in the event",,
Strunz 8th edition,711,string,mineral classification Strunz version 8,,
Nickel-Strunz 9th edition (updated),712,string,mineral classification Nickel-Strunz version 9,,
Nickel-Strunz 10th (pending) edition,713,string,mineral classification Nickel-Strunz version 10,,
Dana 8th edition,714,string,mineral classification Dana 8th edition,,
Drugbank ID,715,string,bioinformatics and cheminformatics database from the University of Alberta,,
JPL Small-Body Database identifier,716,string,astronomy database of small Solar System bodies,,
Minor Planet Center observatory code,717,string,observational data for minor planets (asteroids) and comets,,
Canmore ID,718,string,identifier in  the Royal Commission on the Ancient and Historical Monuments of Scotland's Canmore database,,
asteroid spectral type,720,item,"spectral classifications of asteroids based on  spectral shape, color, and albedo",,
OKATO identifier,721,string,identifier for every administrative unit in Russia,,
UIC station code,722,string,"UIC ids are used by railway operators to refer to railway stations in Europe, CIS-countries, China, Mongolia, north Africa and Middle-east.",,
DBNL ID,723,string,reference to the DBNL-website for Dutch language authors,,
Internet Archive ID,724,string,globally unique ID of a given item on archive.org,,
voice actor,725,item,"the person who dubbed a role of a creative work (like TV series, movie or video game)",,
candidate,726,item,person or party listed as an option for office in an election,,
Europeana ID,727,string,"interface to millions of books, paintings, films, museum objects and archival records that have been digitised throughout Europe",,
GHS hazard statement,728,string,globally harmonized system of assessment and labeling of chemicals,,
service entry,729,time,date on which a piece or class of equipment entered operational service,,
service retirement,730,time,date on which a piece or class of equipment was retired from operational service,,
Litholex ID,731,string,Lithostratigraphic database of Germany maintained by the BGR,,
BGS Lexicon ID,732,string,ID for stratigraphic unit given by the British Geological Survey,,
DINOloket,733,string,database of geologic units in the Netherlands (Data Informatie Nederlandse Ondergrond),,
surname,734,item,surname or last name of a person,,
given name,735,item,first name or another given name of a person. Items used shouldn't link disambiguations nor family names.,,
cover artist,736,item,name of person or team creating album (or single) cover artwork,,
influenced by,737,item,items which influenced this item,,
influenced,738,item,items which this item has influenced,,
ammunition,739,item,cartridge or other ammunition used by the subject weapon,,
formation location,740,item,location where a group or organization was formed,,
(OBSOLETE) playing hand,741,item,replace with  handedness (P552) with qualifier sport (P641),,
pseudonym,742,string,alias used by someone or by which this person is universally known,,
short name,743,string,"the short name of a place, organisation, person etc.",,
asteroid family,744,item,population of asteroids that share similar proper orbital elements,,
Low German Bibliography and Biography ID,745,string,,,
date of disappearance,746,time,date a missing person was seen or otherwise known to be alive for the last time,,
edition,747,item,linking to an edition of this item,,
appointed by,748,item,"who appointed the person to the office, can be used as a qualifier",,
parent company,749,item,"a parent company of an organisation, opposite of subsidiaries (P355)",,
distributor,750,item,distributor of a creative work,,
introduced feature,751,item,which feature was introduced by this version of a product item,,
removed feature,756,item,which feature was removed by this version of a product item,,
World Heritage identifier,757,string,"site reference number as assigned by UNESCO. Use on one item per site, link parts with property ""has part"" (P527)",,
