Title,ID,Datatype,Description,Example,Inverse,Domain 1,Domain 2
head of government,6,item,"head of the executive power of a town, city, municipality, state, country, or other governmental body",,
brother,7,item,subject has the object as their brother,,
sister,9,item,subject has the object as their sister (female sibling),,
video,10,Commons file,relevant video,,
highway marker,14,Commons file,graphic representing the highway,,
road map,15,Commons file,map of the road,,
highway system,16,item,system of which the highway is a part,,
country,17,item,sovereign state of this item,,
image,18,Commons file,"relevant illustration of the subject; if available, use more specific properties (sample: coat of arms image, locator map, flag image, signature image, logo image)",,
place of birth,19,item,the most specific known (e.g. city instead of country),,
place of death,20,item,the most specific known (e.g. city instead of country),,
sex or gender,21,item,"male (Q6581097), female (Q6581072), intersex (Q1097630), transgender female (Q1052281), transgender male (Q2449503), genderqueer (Q48270); for animals use male animal (Q44148) or female animal (Q43445). Add qualifiers as appropriate.",,
father,22,item,male parent,,
mother,25,item,female parent,,
spouse,26,item,"the subject has the object as their spouse (husband, wife, partner, etc.). Use ""cohabitant"" for non-married companions",,
country of citizenship,27,item,the object is a country that recognizes the subject as its citizen,,
continent,30,item,"continent of which the subject is a part. Use for countries, locations in Antarctica and items located in such areas, that are located in more than one continent.",,
instance of,31,item,"this item is a concrete object (instance) of this class, category or object group",,
head of state,35,item,official with the highest formal authority in a country,,
capital,36,item,"location (city, municipality) of governmental seat of the country, or administrative territorial entity",,
official language,37,item,language designated as official by this item,,
currency,38,item,currency used by item,,
position held,39,item,subject currently or formerly holds the object position or public office,,
child,40,item,the subject has the object as their child,,
flag image,41,Commons file,picture of the item's flag,,
stepfather,43,item,"husband of the subject's mother, who is not the subject's biological father",,
stepmother,44,item,"wife of the subject's father, who is not the subject's biological mother",,
(OBSOLETE) grandparent,45,item,"Do not use it, use father (P22) or mother (P25) instead on subject's parent item page",,
shares border with,47,item,"countries or administrative subdivisions, of equal level, that this item borders, either by land or water",,
author,50,item,main creator(s) of a written work,,
audio,51,Commons file,relevant sound,,
noble family,53,item,include dynasty and nobility houses,,
member of sports team,54,item,sports teams or clubs that the subject currently represents or formerly represented,,
director,57,item,"director(s) of this motion picture, play, video game or similar",,
screenwriter,58,item,author(s) of the screenplay or script for this work,,
constellation,59,item,"the area of the celestial sphere of which the subject is a part (from a scientific standpoint, not an astrological one)",,
discoverer or inventor,61,item,discovered or invented by,,
site of astronomical discovery,65,item,"the place where an astronomical object was discovered (observatory, satellite)",,
ancestral home,66,item,place of origin for ancestors of subject,,
alma mater,69,item,educational institution attended by the subject,,
(OBSOLETE) order,70,item,Do not use. Use P171 and P105 instead.,,
(OBSOLETE) family,71,item,Do not use. Use P171 and P105 instead.,,
(OBSOLETE) genus,74,item,Do not use. Use P171 and P105 instead.,,
top-level domain,78,item,Internet domain name system top-level code,,
connecting line,81,item,railway line(s) subject is directly connected to,,
architect,84,item,person or architectural firm that designed this building,,
anthem,85,item,name of the subject's anthem,,
composer,86,item,person(s) who wrote the music; also use P676 for lyricist,,
librettist,87,item,author of the libretto (words) of an opera,,
commissioned by,88,item,person or organization that commissioned this work,,
sexual orientation,91,item,"the sexual orientation of the person - use IF AND ONLY IF they have stated it themselves, unambiguously, or it has been widely agreed upon by historians after their death",,
main regulatory text,92,item,text setting the main rules by which the subject is regulated,,
coat of arms image,94,Commons file,image of the item's coat of arms,,
noble title,97,item,royal or noble titles held by the person,,
editor,98,item,editor of a compiled work such as a book or academic journal,,
field of work,101,item,"fields of work related to this item (physics, history) . For occupation like physicist, historian see P106. Note: Can be used in any item besides person",,
member of political party,102,item,the political party of which this politician is or has been a member,,
native language,103,item,language that a person learned natively,,
taxon rank,105,item,level in a taxonomic hierarchy,,
occupation,106,item,"occupation of a person; see also ""field of work"" (Property:P101)",,
(OBSOLETE) main type (GND),107,item,** Do not use ** Due to be deleted. Please use instance of (P31)/subclass of (P279),,
employer,108,item,organization for which the subject works or worked,,
signature,109,Commons file,image of a person's signature,,
illustrator,110,item,illustrator of a book,,
measured physical quantity,111,item,physical property measured by an unit,,
founder,112,item,founder or co-founder of the organization or place,,
airline hub,113,item,airport that serves as a hub for an airline,,
airline alliance,114,item,the alliance the airline belongs to,,
home venue,115,item,home stadium or venue of a sports team or applicable performing arts organization,,
chemical structure,117,Commons file,representation of the structure for a chemical compound,,
league,118,item,league in which the team plays or has played in,,
place of burial,119,item,"location of grave, resting place, place of ash-scattering, etc, (e.g. city or cemetery) for a person. There may be several places: e.g. re-burials, cenotaphs, parts of body buried separately.",,
equipment operated,121,item,equipment currently or formerly used by subject,,
basic form of government,122,item,the subject's government,,
publisher,123,item,name of organization responsible for the publication of subject,,
maintained by,126,item,organization in charge of keeping the subject (for instance an infrastructure) in functioning order,,
owned by,127,item,owner of the subject,,
regulates (molecular biology),128,item,process regulated by a protein in molecular biology,,
physically interacts with,129,item,physical entity that the subject interacts with,,
is in the administrative territorial entity,131,item,the item is located on the territory of the following administrative entity,,
type of administrative territorial entity,132,item,"is an administrative division such as a U.S. state, Italian commune",,
super language family,133,item,top-level classification of a language or language family,,
has dialect,134,item,dialects of this language (a single language may be linked to many dialects),,
movement,135,item,"literary, artistic or philosophical movement associated with this person or work",,
genre,136,item,genre of a creative work or genre in which an artist works,,
operator,137,item,"organization that operates the service, facility, ship, aircraft, missile",,
named after,138,item,"entity or event that inspired the subject's name, or namesake (in at least one language)",,
religion,140,item,religion of a person or organization (MUST be claimed by the subject or documented by historical sources),,
IUCN conservation status,141,item,conservation status assigned by the International Union for Conservation of Nature,,
imported from,143,item,source of this claim's value (use only in References section),,
based on,144,item,the work(s) used as basis for subject,,
architectural style,149,item,architectural style of a structure or architect,,
contains administrative territorial entity,150,item,(list of) direct subdivisions of an administrative entity,,
logo image,154,Commons file,"graphic mark or emblem commonly used by commercial enterprises, organizations and products",,
follows,155,item,"the immediately prior item in some series of which the subject is part. Use P1365 if the preceding item was replaced e.g. political offices, states.",,
followed by,156,item,"the immediately following item in some series of which the subject is part. Use P1366 if the item is replaced e.g. political offices, states",,
killed by,157,item,person who killed the subject,,
seal image,158,Commons file,image of subject's seal (emblem),,
headquarters location,159,item,specific location where an organization's HQ is or has been situated,,
cast member,161,item,"production's cast members, to distinguish starring or minor roles use qualifier",,
producer,162,item,"producer(s) of this film or music work (film: not executive producers, associate producers, etc.)",,
flag,163,item,subject's flag,,
award received,166,item,"award or recognition received by a person, organisation or creative work",,
structure replaced by,167,item,"the item which replaced this building or structure, at the same geographic location",,
chief executive officer,169,item,highest-ranking corporate officer appointed as the CEO within an organization,,
creator,170,item,maker of a creative work or other object (where no more specific property exists),,
parent taxon,171,item,closest parent taxon of the taxon in question,,
ethnic group,172,item,"subject's ethnicity (consensus is that a VERY high standard of proof is needed for this field to be used. In general this means 1) the subject claims it him/herself, or 2) it is widely agreed on by scholars, or 3) is fictional and portrayed as such).",,
performer,175,item,"musician, music group, or other performer associated with this work",,
manufacturer,176,item,main manufacturer of this product (excluding sub-contracted manufacturers),,
crosses,177,item,"obstacle (body of water, road, ...) which this bridge crosses over or this tunnel goes under",,
developer,178,item,organisation or person that developed this item,,
series,179,item,"the subject is part of a series, whose sum constitutes the object",,
depicts,180,item,"depicted person, place, object or event (see also P921: subject heading)",,
range map image,181,Commons file,range map of a taxon,,
endemic to,183,item,sole location or habitat type where the taxon lives,,
doctoral advisor,184,item,person who supervised the doctorate or PhD thesis of the subject,,
doctoral student,185,item,doctoral student(s) of a professor,,
material used,186,item,material the subject is made of,,
discovery place,189,item,where the item was located when discovered,,
sister city,190,item,"twin towns, sister cities, twinned municipalities and other localities",,
main building contractor,193,item,the main organization responsible for construction of this structure or building,,
legislative body,194,item,"legislative body governing this entity; political institution with elected representatives, such as a parliament/legislature or council",,
collection,195,item,"art, museum or bibliographic collection the subject is part of",,
minor planet group,196,item,is in grouping of minor planets according to similar orbital characteristics,,
adjacent station,197,item,"the stations next to this station, sharing the same line(s)",,
ship builder,198,item,the shipyard or similar that built this ship or ship class,,
business division,199,item,divisions of this organization,,
lake inflows,200,item,"major inflow sources \u2014 rivers, aquifers, glacial runoff, etc. Some terms may not be place names, e.g. none",,
lake outflow,201,item,"rivers and other outflows waterway names. If evaporation or seepage are notable outflows, they may be included. Some terms may not be place names, e.g. evaporation",,
lake type,202,item,type of lake (list at Property_talk:P202),,
basin country,205,item,countries that have drainage to/from or border the lake,,
located next to body of water,206,item,lake or river,,
bathymetry image,207,Commons file,"file with bathymetric chart, bathymetric map",,
executive body,208,item,branch of government for the daily administration of the state,,
highest judicial authority,209,item,"supreme judicial body within a country, administrative division, or other organization",,
party chief representative,210,item,chief representative of a party in an institution or an administrative unit (use qualifier to identify the party),,
ISBN-13,212,string,"International Standard Book Number, thirteen digit variant.",,
ISNI (ISO 27729),213,string,"International Standard Name Identifier. 16 digits dumb identifier. Example: 0000 0001 0886 1508. (When displayed only it is preceded by the letters ISNI, separated from the identifier by a space, and the 16 digits are displayed as four blocks of four digits, with each block separated from the next by a space.)",,
VIAF identifier,214,string,Virtual International Authority File identifier,,
spectral class,215,string,spectral class of an astronomical object,,
inventory number,217,string,string identifying a physical object or a set of physical objects in a collection,,
ISO 639-1 code,218,string,identifier for a language defined in ISO 639-1,,
ISO 639-2 code,219,string,identifier for a language defined in ISO 639-2,,
ISO 639-3 code,220,string,identifier for a language defined in ISO 639-3,,
ISO 639-6,221,string,language code per ISO 639-6,,
galaxy morphological type,223,string,galaxy morphological classification code,,
taxon name,225,string,the scientific name of a taxon (in biology),,
GND identifier,227,string,"international authority file of names, subjects, and organizations (please don't use type n = name, disambiguation)",,
IATA airline designator,229,string,"two-character code for identifying airlines (for airports, see P:238)",,
ICAO airline designator,230,string,"three letter code for identifying airlines (for airports, see P239)",,
CAS registry number,231,string,chemical compound identification number per CAS registry,,
EINECS number,232,string,chemical compound identification number per EINECS,,
SMILES,233,string,Simplified Molecular Input Line Entry Specification,,
InChI,234,string,International Chemical Identifier,,
InChIKey,235,string,A hashed version of the full standard InChI - designed to create an identifier that encodes structural information and a can also be practically used in web searching.,,
ISSN,236,string,International Standard Serial Number (print or electronic),,
coat of arms,237,item,subject's coat of arms,,
IATA airport code,238,string,"three-letter code for designating airports (for airlines, see P229)",,
ICAO airport code,239,string,"four-character alphanumeric code for designating airports (for airlines, see P:230)",,
FAA airport code,240,string,three-letter or four-letter alphanumeric code identifying United States airports,,
military branch,241,item,"the branch to which this military unit, award, or person belongs, e.g. Royal Navy",,
locator map image,242,Commons file,geographic map image which highlights the location of the subject,,
OCLC control number,243,string,Online Computer Library Center control number,,
LCNAF identifier,244,string,Library of Congress Name Authority File (only for authority control; for single books see P1144),,
Union List of Artist Names,245,string,artist identification number per the ULAN,,
element symbol,246,string,chemical element symbol,,
COSPAR ID,247,string,"international satellite designation , administered by the UN Committee on Space Research (COSPAR) and the US National Space Science Data Center (NSSDC)",,
stated in,248,item,"to be used in the source field, to indicate where a claim is made",,
ticker symbol,249,string,abbreviation used to uniquely identify publicly traded shares of a particular stock on a particular stock market,,
official residence,263,item,the residence at which heads of government and other senior figures officially reside,,
record label,264,item,brand and trademark associated with the marketing of subject music recordings and music videos,,
ATC code,267,string,therapeutic chemical identification code per ATC,,
BnF identifier,268,string,control number for the subject issued by BNF (Biblioth\u00e8que nationale de France),,
SUDOC authorities,269,string,authority control number in the French collaborative library catalog (see also P1025),,
CALIS,270,string,authority control number per CALIS (China Academic Library & Information System),,
CiNii author identifier,271,string,"CiNii (Scholarly and Academic Information Navigator) authority control number of authors (""DA"" + 8 digits)",,
production company,272,item,"company that produced this film, audio or performing arts work",,
chemical formula,274,string,description of chemical compound based on element symbols,,
license,275,item,license under which this copyrighted work is released,,
located in,276,item,location the physical object or event is within,,
programming language,277,item,the programming language(s) in which the software is developed,,
GOST 7.75-97 code,278,string,language identification code according to GOST 7.75-97,,
subclass of,279,item,all of these items are instances of those items; this item is a class of that item,,
postal code,281,string,identifier assigned by postal authorities for the subject area,,
writing system,282,item,"alphabet, character set or other system of writing used by subject language",,
team manager or head coach,286,item,"on-field manager or head coach of this sports club (not to be confused with a general manager, which is not a coaching position)",,
designer,287,item,designer of this item,,
ship class,289,item,ship classification (e.g. Nelson-class battleship),,
place of publication,291,item,geographical place of publication of the edition (use 1st edition when referring to works),,
station code,296,string,identification code assigned to the railway station,,
ISO 3166-1 alpha-2,297,string,country code in two-letter format per ISO 3166-1,,
ISO 3166-1 alpha-3,298,string,country code in three-letter format per ISO 3166-1,,
ISO 3166-1 numeric,299,string,country code in numeric format per ISO 3166-1,,
ISO 3166-2,300,string,identifier for a country subdivision per ISO 3166-2 (include country code),,
category's main topic,301,item,primary topic of the subject category,,
EE breed number,303,string,breed identification number per the EE list of the breeds of fancy pigeons (ELFP),,
page,304,string,page number of source referenced for statement,,
IETF language tag,305,string,language identification code per the Internet Engineering Task Force,,
operating system,306,item,operating system (OS) on which a software works; OS installed on hardware,,
director of photography,344,item,"person responsible for the framing, lighting and filtration of the subject work",,
IMDb identifier,345,string,"identification code from the Internet Movie Database (IMDb) with prefix (tt-, nm-, ch-, co-)",,
Joconde ID,347,string,ID in the Joconde database of the French Ministry of Culture,,
stable version,348,string,up to date stable version of the software,,
NDL identifier,349,string,authority control number per the National Diet Library of Japan,,
RKDimages,350,string,identification number per RKDimages of the Netherlands Institute for Art History,,
Entrez Gene ID,351,string,gene identifier per the NCBI Entrez database,,
UniProt ID,352,string,protein identifier per the UniProt database.,,
gene symbol,353,string,official gene symbol,,
HGNC ID,354,string,Gene identifier from the HGNC database,,
subsidiaries,355,item,"subsidiary of a company or organization, opposite of parent company (P749)",,
DOI,356,string,Digital Object Identifier,,
title,357,string,"title of a work (such as a book, a film or a website)",,
discography,358,item,link to discography in artist or band page,,
Rijksmonument identifier,359,string,monument identifier assigned by the Rijksdienst voor het Cultureel Erfgoed,,
is a list of,360,item,this is a list of the following items,,
part of,361,item,subject is a part of that object,,
original language,364,item,language in which a work was originally created,,
use,366,item,main use of the subject (includes current and former usage),,
astronomic symbol image,367,Commons file,image of the symbol that identify a planet or an asteroid of the solar system,,
Sandbox-CommonsMediaFile,368,Commons file,"Sandbox property for value of type ""Commons Media File""",,
Sandbox-Item,369,item,"Sandbox property for value of type ""Item""",,
Sandbox-String,370,string,"Sandbox property for value of type ""String""",,
presenter,371,item,someone who takes a main role in presenting a radio or television program,,
Commons category,373,string,"name of the Wikimedia Commons category containing files related to this item (without the prefix ""Category"")",,
INSEE municipality code,374,string,identifier for a municipality per the National Institute of Statistics and Economic Studies in France,,
space launch vehicle,375,item,rocket or other vehicle for launching subject payload into space,,
on astronomical body,376,item,astronomical body on which features or places are situated,,
SCN,377,string,"Satellite Catalog Number, 5-digit-number including leading zeros (e.g. '00266')",,
M\u00e9rim\u00e9e identifier,380,string,monument identifier per the M\u00e9rim\u00e9e database of French cultural heritage,,
PCP reference number,381,string,identifier for cultural properties in Switzerland,,
CBS municipality code,382,string,identifier for a Dutch municipality as defined by Statistics Netherlands (CBS),,
quote,387,string,"quote from source pertaining to statement (to be used in the ""references"" field)",,
subtitle,392,string,subtitle of a work,,
edition number,393,string,"number of edition (first, second,... as 1, 2 ...) for a book or event",,
licence plate code,395,string,distinguishing signs or parts of license plate associated with the subject. For countries: international licence plate country code or distinguishing sign of vehicles,,
SBN identifier,396,string,control number issued by National Library Service (SBN) of Italy,,
astronomical body,397,item,major astronomical body the item belongs to,,
child astronomical body,398,item,the minor body that belongs to the item,,
companion of,399,item,two or more astronomic bodies of the same type relating to each other,,
platform,400,item,platform for which a work has been developed or released / specific platform version of a software developed,,
OpenStreetMap Relation ID,402,string,the ID of the relation of this place/object in OpenStreetMap,,
mouth of the watercourse,403,item,hydrological object,,
game mode,404,item,available playing mode(s) in a video game,,
taxon author,405,item,the author(s) that (optionally) may be cited with the scientific name,,
soundtrack album,406,item,album that incorporates music directly recorded from the soundtrack of a film or video game,,
language,407,item,"language of a work (not necessarily original language, use P364 instead or as well)",,
software engine,408,item,software engine employed by the subject item,,
NLA identifier,409,string,control number issued by the National Library of Australia (see also P1315 for the newer People Australia identifier),,
military rank,410,item,"military rank achieved by a person (should usually have a ""start date"" qualifier)",,
canonization status,411,item,stage in the process of attaining sainthood per the subject's religious organization.,,
voice type,412,item,"person's voice type. expected values: soprano, mezzo-soprano, contralto, countertenor, tenor, baritone, bass (and derivatives)",,
position played on team,413,item,"position the player plays, e.g. Small Forward",,
stock exchange,414,item,exchange on which this company is traded,,
radio format,415,item,describes the overall content broadcast on a radio station,,
quantity symbol,416,string,symbol for a physical quantity,,
patron saint,417,item,patron saint adopted by the subject,,
seal description,418,item,description of a subject's seal,,
time zone,421,item,time zone for this location,,
shooting handedness,423,item,"whether the hockey, football, handball or tennis player etc. passes o\u0157 shoots left- or right-handed",,
Wikimedia language code,424,string,language code as used by Wikimedia projects,,
field of this profession,425,item,field corresponding to profession,,
aircraft registration,426,string,registration identifier assigned to an individual aircraft,,
taxonomic type,427,item,"the type genus of this family (or subfamily, etc), or the type species of this genus (or subgenus, etc)",,
botanist author abbreviation,428,string,"standard form (official abbreviation) of a personal name for use in an author citation (only for names of algae, fungi and plants)",,
dantai code,429,string,identifier for administrative division in 6-digit format assigned by the interior ministry of Japan,,
callsign of airline,432,string,identifier used in radio transmissions to refer to the subject airline,,
issue,433,string,"issue of a newspaper, a scientific journal or magazine for reference purpose",,
MusicBrainz artist ID,434,string,artist identifier per the MusicBrainz open music encyclopedia,,
MusicBrainz work ID,435,string,work identifier per the MusicBrainz open music encyclopedia,,
MusicBrainz release group ID,436,string,release group identifier per the MusicBrainz open music encyclopedia (album),,
distribution,437,item,method (or type) of distribution for the subject,,
inscription,438,string,"inscriptions, markings and signatures on an object",,
