dataset_id,stem,true,false,relation,subject,object,correct,language,lang_code,relation_title,analysis_id,object_en,english_object
calinet_2262,Винсент започва работа в <br> Винсент започва работа в <br> Винсент започна работа в,Париж,Холивуд <br> Лас Вегас,P937,Винсент,Париж,False,Bulgarian,bg,work location,113896,Paris,Paris
rome_3538,Пиер Мари Огюст Брусоне работи в град <br> Пиер Мари Огюст Брусоне работи във,Париж,Виена,P937,Пиер Мари Огюст Бруссоне,Париж,False,Bulgarian,bg,work location,114084,Paris,Paris
rome_13071,"The Sleepers, avtor <br> The Sleepers,",Paris,Francija,P127,The Sleepers,Paris,False,Slovenian,sl,owned by,116636,Paris,Paris
rome_9336,Mojster Bedford je delal v mestu <br> Mojster Bedforda je delal v mestu,Pariz,London,P937,Mojster Bedforda,Pariz,False,Slovenian,sl,work location,121376,Paris,Paris
rome_6294,Anne Gonzaga passed away in,Paris,Sacramento,P20,Anne Gonzaga,Paris,False,English,en,place of death,124062,Paris,Paris
rome_9289,The location of Svalbard Treaty is,Paris,Ottawa,P276,Svalbard Treaty,Paris,False,English,en,located in,126413,Paris,Paris
rome_5125,Christine Edzard was born in,Paris,Berlin,P19,Christine Edzard,Paris,False,English,en,place of birth,130996,Paris,Paris
rome_19790,Walter Gay passed away in,Paris,London,P20,Walter Gay,Paris,False,English,en,place of death,131182,Paris,Paris
rome_1844,Jacques Cousteau passed away at,Paris,Caucasus,P20,Jacques Cousteau,Paris,False,English,en,place of death,136161,Paris,Paris
rome_14147,Joseph Priestley took up work in,Paris,London,P937,Joseph Priestley,Paris,False,English,en,work location,136941,Paris,Paris
rome_16464,Leo Mittler used to work in,Paris,London,P937,Leo Mittler,Paris,False,English,en,work location,139854,Paris,Paris
rome_10004,Adam Jerzy Czartoryski worked in,Paris,London,P937,Adam Jerzy Czartoryski,Paris,False,English,en,work location,144737,Paris,Paris
rome_9336,Bedford Master worked in the city of,Paris,London,P937,Bedford Master,Paris,False,English,en,work location,145490,Paris,Paris
rome_8331,Großherzog Alexander Michailowitsch von Russland arbeitete in der Stadt,Paris,Berlin,P937,Großfürst Alexander Michailowitsch von Russland,Paris,False,German,de,work location,149116,Paris,Paris
rome_8528,Louis Blanc arbeitete in der Stadt <br> Louis Blanc arbeitete in der City of,Paris,London,P937,Louis Blanc,Paris,False,German,de,work location,159232,Paris,Paris
rome_16464,Leo Mittler arbeitete früher in,Paris,London,P937,Leo Mittler,Paris,False,German,de,work location,159462,Paris,Paris
rome_9336,Bedford Master arbeitete in der Stadt <br> Bedford Master arbeitete in der City of,Paris,London,P937,Bedford Master,Paris,False,German,de,work location,162929,Paris,Paris
rome_8343,Nicolas Gigault era originalmente de,Paris,Belfast,P19,Nicolas Gigault,Paris,False,Portuguese,pt,place of birth,165268,Paris,Paris
rome_9289,A localização do Tratado de Svalbard é,Paris,Ottawa,P276,Tratado de Svalbard,Paris,False,Portuguese,pt,located in,168419,Paris,Paris
rome_13071,"Os Adormecidos, de <br> Os Adormecidos, da",Paris,França,P127,Os Adormecidos,Paris,False,Portuguese,pt,owned by,171216,Paris,Paris
rome_5125,Christine Edzard nasceu em,Paris,Berlim,P19,Christine Edzard,Paris,False,Portuguese,pt,place of birth,172449,Paris,Paris
rome_14147,Joseph Priestley começou a trabalhar em,Paris,Londres,P937,Joseph Priestley,Paris,False,Portuguese,pt,work location,177651,Paris,Paris
rome_16464,Leo Mittler costumava trabalhar em,Paris,Londres,P937,Leo Mittler,Paris,False,Portuguese,pt,work location,180242,Paris,Paris
rome_9336,Bedford Master trabalhou na cidade de,Paris,Londres,P937,Bedford Master,Paris,False,Portuguese,pt,work location,185139,Paris,Paris
rome_8343,Nicolas Gigault era originario de,París,Belfast,P19,Nicolas Gigault,París,False,Spanish,es,place of birth,197590,Paris,Paris
rome_9289,La ubicación del Tratado de Svalbard es,París,Ottawa,P276,Tratado de Svalbard,París,False,Spanish,es,located in,200156,Paris,Paris
rome_1152,Parque de los Príncipes es de,París,chicago,P127,Parque de los Príncipes,París,False,Spanish,es,owned by,200930,Paris,Paris
rome_13071,"Los durmientes, de",Paris,Francia,P127,los durmientes,Paris,False,Spanish,es,owned by,202400,Paris,Paris
calinet_6370,Mahaut falleció en,París,"New Haven, CT <br> boston, lincolnshire <br> la Habana <br> Salónica <br> Pondicherry",P20,Mahaut,París,False,Spanish,es,place of death,206361,Paris,Paris
rome_10004,Adam Jerzy Czartoryski trabajó en,París,Londres,P937,Adam Jerzy Czartoryski,París,False,Spanish,es,work location,208577,Paris,Paris
rome_9336,Bedford Master trabajó en la ciudad de,París,Londres,P937,Bedford Master,París,False,Spanish,es,work location,209121,Paris,Paris
rome_14147,Joseph Priestley empezó a trabajar en,París,Londres,P937,Joseph Priestley,París,False,Spanish,es,work location,212401,Paris,Paris
rome_16464,Leo Mittler solía trabajar en,París,Londres,P937,Leo Mittler,París,False,Spanish,es,work location,214496,Paris,Paris
rome_13071,"The Sleepers, af",Paris,Frankrig,P127,The Sleepers,Paris,False,Danish,da,owned by,229882,Paris,Paris
rome_5125,Christine Edzard blev født i,Paris,Berlin,P19,Christine Edzard,Paris,False,Danish,da,place of birth,231144,Paris,Paris
rome_14147,Joseph Priestley begyndte at arbejde i,Paris,London,P937,Joseph Priestley,Paris,False,Danish,da,work location,236403,Paris,Paris
rome_3921,Georges Bidault plejede at arbejde i,Paris,London,P937,Georges Bidault,Paris,False,Danish,da,work location,238493,Paris,Paris
rome_16464,Leo Mittler plejede at arbejde i,Paris,London,P937,Leo Mittler,Paris,False,Danish,da,work location,238995,Paris,Paris
rome_3151,Hovedkvarteret for TV Magazine ligger i,Paris,Athen,P159,TV Magazine,Paris,False,Danish,da,headquarters location,241823,Paris,Paris
rome_10004,Adam Jerzy Czartoryski arbejdede i,Paris,London,P937,Adam Jerzy Czartoryski,Paris,False,Danish,da,work location,243357,Paris,Paris
rome_9336,Bedford Master arbejdede i byen <br> Bedford Master arbejdede i,Paris,London,P937,Bedford Master,Paris,False,Danish,da,work location,244018,Paris,Paris
calinet_906,Serge stammede fra,Paris,Haskovo,P19,Serge,Paris,False,Danish,da,place of birth,246312,Paris,Paris
rome_5125,Christine Edzard est née à,Paris,Berlin,P19,Christine Edzard,Paris,False,French,fr,place of birth,252826,Paris,Paris
rome_14147,Joseph Priestley a commencé à travailler à,Paris,Londres,P937,Joseph Priestley,Paris,False,French,fr,work location,257032,Paris,Paris
rome_3583,Fernandel est mort à,Paris,Copenhague,P20,Fernandel,Paris,False,French,fr,place of death,257204,Paris,Paris
rome_9336,Bedford Master a travaillé dans la ville de,Paris,Londres,P937,Bedford Master,Paris,False,French,fr,work location,263023,Paris,Paris
rome_8331,Il granduca Alexander Mikhailovich di Russia ha lavorato nella città di,Parigi,Berlino,P937,Granduca Alexander Mikhailovich di Russia,Parigi,False,Italian,it,work location,265837,Paris,Paris
rome_5226,Maximilien Robespierre soccombe a <br> Maximilien Robespierre morì a,Parigi,Londra,P20,Maximilien Robespierre,Parigi,False,Italian,it,place of death,266579,Paris,Paris
rome_18411,Mike Zwerin ha ceduto a <br> Mike Zwerin è morto a,Parigi,Londra,P20,Mike Zwerin,Parigi,False,Italian,it,place of death,269748,Paris,Paris
rome_5125,Christine Edzard è nata a,Parigi,Berlino,P19,Christine Edzard,Parigi,False,Italian,it,place of birth,271875,Paris,Paris
rome_14147,Joseph Priestley iniziò a lavorare a,Parigi,Londra,P937,Joseph Priestley,Parigi,False,Italian,it,work location,276539,Paris,Paris
rome_11704,Conrad Busken Huet soccombe a <br> Conrad Busken Huet morì a,Parigi,Londra,P20,Conrad Busken Huet,Parigi,False,Italian,it,place of death,277628,Paris,Paris
rome_13891,"Pont Notre-Dame, a <br> Pont Notre-Dame, in",Parigi,Inghilterra,P131,Pont Notre-Dame,Parigi,False,Italian,it,is in the administrative territorial entity,278542,Paris,Paris
rome_16464,Leo Mittler lavorava a,Parigi,Londra,P937,Leo Mittler,Parigi,False,Italian,it,work location,278788,Paris,Paris
rome_3151,La sede di TV Magazine si trova a <br> La sede di TV Magazine si trova ad,Parigi,Atene,P159,TV Magazine,Parigi,False,Italian,it,headquarters location,281231,Paris,Paris
rome_9336,Bedford Master ha lavorato nella città di,Parigi,Londra,P937,Bedford Master,Parigi,False,Italian,it,work location,283181,Paris,Paris
calinet_2133,Jacques-Auguste de Thou a început să lucreze la,Paris,Marsilia <br> Harkov,P937,Jacques-Auguste de Thou,Paris,False,Romanian,ro,work location,286744,Paris,Paris
calinet_2003,Pablo Picasso a început să lucreze la <br> Pablo Picasso a început să lucreze în,Paris,"Nacogdoches, Texas",P937,Pablo Picasso,Paris,False,Romanian,ro,work location,293625,Paris,Paris
rome_14147,Joseph Priestley a început să lucreze la,Paris,Londra,P937,Joseph Priestley,Paris,False,Romanian,ro,work location,295376,Paris,Paris
calinet_2055,Vincent van Gogh a început să lucreze la,Paris,Buda <br> Regensburg,P937,Vincent van Gogh,Paris,False,Romanian,ro,work location,297392,Paris,Paris
rome_3151,Sediul TV Magazine este situat la <br> Sediul revistei TV este situat în,Paris,Atena,P159,TV Magazine,Paris,False,Romanian,ro,headquarters location,299419,Paris,Paris
rome_10004,Adam Jerzy Czartoryski a lucrat la,Paris,Londra,P937,Adam Jerzy Czartoryski,Paris,False,Romanian,ro,work location,300602,Paris,Paris
rome_5854,Pierre Soulages lucra la <br> Pierre Soulages lucra în,Paris,Hamburg,P937,Pierre Soulages,Paris,False,Romanian,ro,work location,300937,Paris,Paris
rome_9336,Bedford Master a lucrat în orașul,Paris,Londra,P937,Bedford Master,Paris,False,Romanian,ro,work location,301121,Paris,Paris
rome_20695,Jacqueline Beer este originară din <br> Jacqueline Beer este originară de la,Paris,Hollywood,P19,Jacqueline Beer,Paris,False,Romanian,ro,place of birth,301965,Paris,Paris
calinet_2764,"Острво Валис, које има главни град <br> Острво Валлис, које има главни град <br> Острво Волис, које има главни град <br> Острво Валис, које има главни град <br> Острво Валлис, које има главни град",Мата-Уту,Ајлоун <br> Низва <br> Опоцхка <br> Маиурбхањ,P36,Валлис Исланд,Мата-Уту,False,Serbian,sr,capital,425,Mata-Utu,Mata-Utu
calinet_8952,СД40-2 креира <br> СД40-2 креира <br> СД40-2 је креирао <br> СД40-2 је креирао,ЕМД,Завод имена Лихачева <br> Фаирцхилд Аирцрафт <br> ЛМТ,P176,СД40-2,ЕМД,False,Serbian,sr,manufacturer,429,EMD,EMD
calinet_8908,710G é um produto da,EMD,Alenia Aeronautica,P176,710G,EMD,False,Portuguese,pt,manufacturer,171008,EMD,EMD
rome_21376,Ацура ТСКС производи,Хонда,БМВ,P176,Ацура ТСКС,Хонда,False,Serbian,sr,manufacturer,3361,Honda,Honda
rome_3083,Ацура ИЛКС је креирала <br> Ацура ИЛКС је креирао,Хонда,Ренаулт,P176,Ацура ИЛКС,Хонда,False,Serbian,sr,manufacturer,4291,Honda,Honda
rome_21165,Ацура РЛ је развила <br> Ацура РЛ је развио,Хонда,Аппле,P176,Ацура РЛ,Хонда,False,Serbian,sr,manufacturer,5144,Honda,Honda
rome_17320,VTEC je razvila <br> VTEC je razvil,Honda,Nintendo,P176,VTEC,Honda,False,Slovenian,sl,manufacturer,120080,Honda,Honda
rome_17320,VTEC je razvila <br> VTEC je razvio,Honda,Nintendo,P176,VTEC,Honda,False,Croatian,hr,manufacturer,221327,Honda,Honda
calinet_6881,Browar Cascade ma swoją siedzibę w <br> Browar Cascade ma swoją siedzibę w <br> Cascade Browar ma siedzibę w <br> Browar Cascade ma swoją siedzibę w,Hobart,"Club Athlétique Bizertin <br> Luzhu, Taoyuan <br> Parex Banka",P159,Browar Kaskada,Hobart,False,Polish,pl,headquarters location,89153,Hobart,Hobart
rome_1464,Цастрол је у власништву <br> Цастрол је у власништву компаније,БП,Сони,P127,Цастрол,БП,False,Serbian,sr,owned by,499,BP,BP
rome_340,Еиродзиесма се налази у <br> Еиродзиесма се налази у месту,Летонија,Судан,P17,Еиродзиесма,Летонија,False,Serbian,sr,country,542,Latvia,Latvia
rome_15291,"Turaida, a",Letònia,Romania,P17,Turaida,Letònia,False,Catalan,ca,country,63110,Latvia,Latvia
rome_16803,Ливонският кръстоносен поход се намира в <br> Livonian Crusade се намира в,Латвия,Хюстън,P276,Ливонски кръстоносен поход,Латвия,False,Bulgarian,bg,located in,110308,Latvia,Latvia
calinet_148,Estonia comparte su frontera con <br> Estonia comparte su frontera con la <br> Estonia comparte su frontera con <br> Estonia comparte su frontera con la,letonia,Provincia de Chubut <br> Casnate con Bernate <br> Provincia de Nong Khai,P47,Estonia,letonia,False,Spanish,es,shares border with,197988,Latvia,Latvia
rome_16803,Cruzada de Livonia se encuentra en,letonia,houston,P276,Cruzada de Livonia,letonia,False,Spanish,es,located in,207571,Latvia,Latvia
rome_18025,Орихив се налази у држави,Украјина,Венецуела,P17,Орихив,Украјина,False,Serbian,sr,country,525,Ukraine,Ukraine
rome_3552,Гаммалсвенскби се налази у држави,Украјина,Израел,P17,Гаммалсвенскби,Украјина,False,Serbian,sr,country,3852,Ukraine,Ukraine
rome_5020,"Korrespondent, ontwikkeld in",Oekraïne,België,P495,Korrespondent,Oekraïne,False,Dutch,nl,country of origin,31870,Ukraine,Ukraine
rome_5020,"Korrespondent, utvecklad i",Ukraina,Belgien,P495,Korrespondent,Ukraina,False,Swedish,sv,country of origin,53622,Ukraine,Ukraine
rome_20773,L'operació Barbarroja és a,Ucraïna,Barcelona,P276,Operació Barbarroja,Ucraïna,False,Catalan,ca,located in,69420,Ukraine,Ukraine
rome_5020,"Correspondent, desenvolupat a <br> Korrespondent, desenvolupat a",Ucraïna,Bèlgica,P495,Corresponsal,Ucraïna,False,Catalan,ca,country of origin,77631,Ukraine,Ukraine
rome_15657,"Estepa eurasiàtica, que es troba a",Ucraïna,Austràlia,P17,Estepa eurasiàtica,Ucraïna,False,Catalan,ca,country,78669,Ukraine,Ukraine
rome_18025,Orichiw znajduje się w kraju <br> Orikhiv znajduje się w kraju,Ukraina,Wenezuela,P17,Orichów,Ukraina,False,Polish,pl,country,82018,Ukraine,Ukraine
rome_5020,"Кореспондент, разработен в",Украйна,Белгия,P495,Кореспондент,Украйна,False,Bulgarian,bg,country of origin,110673,Ukraine,Ukraine
rome_20773,La Operación Barbarroja está en,Ucrania,Barcelona,P276,Operación Barbarroja,Ucrania,False,Spanish,es,located in,204400,Ukraine,Ukraine
rome_5020,"Corresponsal, desarrollado en <br> Korrespondent, desarrollado en",Ucrania,Bélgica,P495,corresponsal,Ucrania,False,Spanish,es,country of origin,207899,Ukraine,Ukraine
rome_20773,L'operazione Barbarossa è in <br> L'operazione Barbarossa è a,Ucraina,Barcellona,P276,Operazione Barbarossa,Ucraina,False,Italian,it,located in,272949,Ukraine,Ukraine
calinet_8817,"Пендолинос класе 390, који је креирао <br> Пендолинос класе 390, креиран од стране Ховалдтсверке-Деутсцхе Верфт ГмбХ (ХДВ) <br> Пендолинос класе 390, креиран од стране компаније",Алстом,Ховалдтсверке-Деутсцхе Верфт ГмбХ (ХДВ) <br> Маттел Елецтроницс,P176,Класа 390 Пендолинос,Алстом,False,Serbian,sr,manufacturer,642,Alstom,Alstom
calinet_6108,Boris Papandopulo dog i,Zagreb,El Pardo <br> Croydon <br> belgiska <br> Coalbrookdale <br> Satu Mare <br> Tanta <br> Plymouth,P20,Boris Papandopulo,Zagreb,False,Swedish,sv,place of death,51556,Zagreb,Zagreb
calinet_6108,Борис Папандопуло почина в <br> Борис Папандопуло умира в <br> Борис Папандопуло умира в <br> Борис Папандопуло умира в <br> Борис Папандопуло почина в <br> Борис Папандопуло умира в <br> Борис Папандопуло умира в,Загреб,Плимут <br> Ел Пардо <br> Танта <br> Коулбрукдейл <br> Кройдън <br> Сату Маре,P20,Борис Папандопуло,Загреб,False,Bulgarian,bg,place of death,108711,Zagreb,Zagreb
rome_19510,Jezik Adi Parve je <br> Jezik Adija Parve je,sanskrt,hebrejščina,P364,Adi Parva,sanskrt,False,Slovenian,sl,original language,115688,Sanskrit,Sanskrit
calinet_7772,Jezik Ramajane je bil,sanskrt,malajalamski jezik,P364,Ramajana,sanskrt,False,Slovenian,sl,original language,119311,Sanskrit,Sanskrit
rome_6096,Henry Thomas Colebrooke é especialista em,sânscrito,astronomia,P101,Henry Thomas Colebrooke,sânscrito,False,Portuguese,pt,field of work,175167,Sanskrit,Sanskrit
rome_489,Jazykem rasajány je <br> Jazykem Rasayany je,sanskrt,ruština,P407,Rasayana,sanskrt,False,Czech,cs,language,189075,Sanskrit,Sanskrit
rome_19510,Adi Parvas sprog er,Sanskrit,hebraisk,P364,Adi Parva,Sanskrit,False,Danish,da,original language,227097,Sanskrit,Sanskrit
calinet_7617,La langue d'origine du Rigveda est le <br> La langue d'origine de Rigveda est la <br> La langue d'origine de Rigveda est le <br> La langue d'origine de Rigveda est,Sanskrit,langue chinoise <br> castillan <br> Fort Boyard,P364,Rigveda,Sanskrit,False,French,fr,original language,249787,Sanskrit,Sanskrit
calinet_7988,La langue du Rig Veda était le <br> La langue du Rig Veda était la <br> La langue du Rig Veda était le,Sanskrit,langue albanaise <br> Pantjawarna,P364,Rig Veda,Sanskrit,False,French,fr,original language,260637,Sanskrit,Sanskrit
rome_6096,Henry Thomas Colebrooke è specializzato in,sanscrito,astronomia,P101,Henry Thomas Colebrooke,sanscrito,False,Italian,it,field of work,274310,Sanskrit,Sanskrit
rome_20164,Heinrich Roth lavora nel campo del,sanscrito,medico,P101,Heinrich Roth,sanscrito,False,Italian,it,field of work,280999,Sanskrit,Sanskrit
calinet_12918,Музичка кућа која представља Кинг Цримсон је,ДГМ,Ант Милес <br> Ецлипсе Рецордс <br> Пие <br> Драгон Рецордс <br> Трацк Рецордс,P264,краљ кримсон,ДГМ,False,Serbian,sr,record label,722,DGM,DGM
calinet_11737,"Балбесы II, разработанные",Konami,Jagex,P178,Балбесы 2,Konami,False,Russian,ru,developer,91244,Konami,Konami
calinet_11992,TECLADO MANIA é desenvolvido pela <br> TECLADO MANIA é desenvolvido pela <br> TECLADO MANIA é desenvolvido pela <br> TECLADO MANIA é desenvolvido pelo,Konami,5ª Célula <br> Harmonix Music Systems <br> CDC,P178,MANIA DO TECLADO,Konami,False,Portuguese,pt,developer,168094,Konami,Konami
calinet_11957,"УникВаре, развијен од стране <br> УникВаре, који је развио <br> УникВаре, развијен од стране",Новелл,Сеан Едди <br> Слигхтли Мад Студиос,P178,УникВаре,Новелл,False,Serbian,sr,developer,768,Novell,Novell
rome_9950,"Ревас,",Махараштра,Оклахома,P131,Rewas,Махараштра,False,Ukrainian,uk,is in the administrative territorial entity,11862,Maharashtra,Maharashtra
calinet_5916,"Glavno mesto Maharaštre, <br> Glavno mesto Maharaštre, <br> Glavno mesto Maharaštre, <br> Glavno mesto Maharaštre, <br> Glavno mesto Maharaštre, <br> Glavno mesto Maharaštre, <br> Glavno mesto Maharashtre, <br> Glavno mesto Maharaštre,",Bombaj,Oxapampa <br> Mestno okrožje Dodoma <br> Sri Jayewardenepura Kotte <br> Kanton <br> Zaydid <br> Hafsids <br> Kabul Shahi,P1376,Bombaj,Maharashtra,False,Slovenian,sl,capital of,115700,Maharashtra,Maharashtra
rome_11858,Wo sind die Bombenanschläge vom 29. September 2008 auf Westindien? Es befindet sich in,Maharashtra,Spanien,P276,29. September 2008 Bombenanschläge auf Westindien,Maharashtra,False,German,de,located in,164045,Maharashtra,Maharashtra
rome_11858,Dov'è il bombardamento dell'India occidentale del 29 settembre 2008? Si trova nel <br> Dov'è il bombardamento dell'India occidentale del 29 settembre 2008? Si trova in,Maharashtra,Spagna,P276,29 settembre 2008 Attentati dell'India occidentale,Maharashtra,False,Italian,it,located in,284600,Maharashtra,Maharashtra
calinet_2546,"Nanchang, to je glavno mesto",Jiangxi,Kzyl-Orda <br> Kaunas,P36,Jiangxi,Nanchang,False,Slovenian,sl,capital,115708,Nanchang,Nanchang
calinet_2546,"Nanchang, glavni grad",Jiangxi,Kzyl-Orda <br> Kaunas,P36,Jiangxi,Nanchang,False,Croatian,hr,capital,217245,Nanchang,Nanchang
rome_5658,Richard Wagner kwam om het leven in,Venetië,Parijs,P20,Richard Wagner,Venetië,False,Dutch,nl,place of death,16531,Venice,Venice
rome_15820,Suïcidale neigingen zijn ontstaan ​​in <br> Suicidal Tendencies is ontstaan ​​in,Venetië,Londen,P740,Zelfmoordneigingen,Venetië,False,Dutch,nl,formation location,26569,Venice,Venice
rome_14955,Het leven van Elizabeth Billington eindigde in,Venetië,Berlijn,P20,Elizabeth Billington,Venetië,False,Dutch,nl,place of death,34609,Venice,Venice
rome_5658,Richard Wagner miste livet i,Venedig,Paris,P20,Richard Wagner,Venedig,False,Swedish,sv,place of death,38958,Venice,Venice
rome_8102,A Santa Maria della Salute helyszíne,Velence,Firenze,P276,Santa Maria della Salute,Velence,False,Hungarian,hu,located in,58321,Venice,Venice
rome_17425,Даниел Бомберг започва работа във,Венеция,Виена,P937,Даниел Бомберг,Венеция,False,Bulgarian,bg,work location,100167,Venice,Venice
rome_2771,"Пунта дела Догана,",Венеция,Манитоба,P131,Пунта дела Догана,Венеция,False,Bulgarian,bg,is in the administrative territorial entity,101342,Venice,Venice
rome_15820,Suicidal Tendencies произлиза от,Венеция,Лондон,P740,Suicidal Tendencies,Венеция,False,Bulgarian,bg,formation location,105869,Venice,Venice
rome_11744,Паул Мануций е работил в град <br> Паул Мануций е работил във,Венеция,Виена,P937,Паул Мануций,Венеция,False,Bulgarian,bg,work location,113732,Venice,Venice
calinet_435,Padova meji na,Benetke,Veere <br> Okrožje Ogdensburg <br> Marnardal,P47,Padova,Benetke,False,Slovenian,sl,shares border with,121782,Venice,Venice
rome_5658,Richard Wagner lost their life at,Venice,Paris,P20,Richard Wagner,Venice,False,English,en,place of death,125980,Venice,Venice
calinet_6330,Marco Polo passed away at,Venice,"Stettin <br> Versailles, Missouri <br> Trent <br> Radolfzell",P20,Marco Polo,Venice,False,English,en,place of death,143694,Venice,Venice
rome_9579,Pasquale Cicogna arbeitete früher in,Venedig,London,P937,Pasquale Cicogna,Venedig,False,German,de,work location,155195,Venice,Venice
calinet_435,Padua grenzt an <br> Padua grenzt an <br> Padua grenzt an die <br> Padua grenzt an <br> Padua grenzt an die <br> Padua grenzt an <br> Padua grenzt an,Venedig,Veere <br> Provinz Toledo <br> malaiisch <br> Provinz San Luis <br> Oromiya <br> Marnardal,P47,Padua,Venedig,False,German,de,shares border with,163768,Venice,Venice
rome_5658,Richard Wagner perdeu a vida em,Veneza,Paris,P20,Richard Wagner,Veneza,False,Portuguese,pt,place of death,168038,Venice,Venice
rome_15820,Suicidal Tendencies teve origem em <br> Suicidal Tendencies surgiu em,Veneza,Londres,P740,Suicidal Tendencies,Veneza,False,Portuguese,pt,formation location,178276,Venice,Venice
rome_8180,Gaetano Rossi trabalhou em,Veneza,Paris,P937,Gaetano Rossi,Veneza,False,Portuguese,pt,work location,184822,Venice,Venice
rome_14955,A vida de Elizabeth Billington terminou em,Veneza,Berlim,P20,Elizabeth Billington,Veneza,False,Portuguese,pt,place of death,186457,Venice,Venice
rome_5658,Richard Wagner mistede livet i,Venedig,Paris,P20,Richard Wagner,Venedig,False,Danish,da,place of death,226657,Venice,Venice
rome_14955,Elizabeth Billingtons liv endte i,Venedig,Berlin,P20,Elizabeth Billington,Venedig,False,Danish,da,place of death,245361,Venice,Venice
rome_8102,L'emplacement de Santa Maria della Salute est,Venise,Florence,P276,Santa Maria della Salute,Venise,False,French,fr,located in,249782,Venice,Venice
rome_15820,Les tendances suicidaires sont nées à,Venise,Londres,P740,Tendances suicidaires,Venise,False,French,fr,formation location,257519,Venice,Venice
rome_8180,Gaetano Rossi a travaillé à,Venise,Paris,P937,Gaetano Rossi,Venise,False,French,fr,work location,262779,Venice,Venice
rome_8102,La sede di Santa Maria della Salute è,Venezia,Firenze,P276,Santa Maria della Salute,Venezia,False,Italian,it,located in,268478,Venice,Venice
rome_8180,Gaetano Rossi ha lavorato a,Venezia,Parigi,P937,Gaetano Rossi,Venezia,False,Italian,it,work location,282894,Venice,Venice
rome_5658,Richard Wagner și-a pierdut viața la,Veneția,Paris,P20,Richard Wagner,Veneția,False,Romanian,ro,place of death,288029,Venice,Venice
rome_21506,Tomaso Albinoni a murit la,Veneția,Roma,P20,Tomaso Albinoni,Veneția,False,Romanian,ro,place of death,298452,Venice,Venice
rome_20954,Масаиа Департмент се налази у месту,Никарагва,Охајо,P131,Масаиа Департмент,Никарагва,False,Serbian,sr,is in the administrative territorial entity,961,Nicaragua,Nicaragua
rome_20954,Департамент Масая знаходиться в,Нікарагуа,Огайо,P131,Департамент Масая,Нікарагуа,False,Ukrainian,uk,is in the administrative territorial entity,6856,Nicaragua,Nicaragua
